{
  "$schema": "https://json-schema.org/draft/2020-12/schema",
  "$id": "https://schemas.vev.software/fabric/v1/data-sharing-lifecycle-event.schema.json",
  "title": "DataSharingLifecycleEvent",
  "type": "object",
  "additionalProperties": false,
  "required": [
    "eventId",
    "occurredAt",
    "binding",
    "enrollmentId",
    "principalId",
    "source",
    "eventType",
    "reasonCode",
    "capability",
    "correlationId"
  ],
  "properties": {
    "eventId": {
      "type": "string",
      "minLength": 1
    },
    "occurredAt": {
      "type": "string",
      "format": "date-time"
    },
    "binding": {
      "$ref": "data-sharing-binding.schema.json"
    },
    "enrollmentId": {
      "type": "string",
      "minLength": 1
    },
    "principalId": {
      "type": "string",
      "minLength": 1
    },
    "source": {
      "type": "string",
      "minLength": 1
    },
    "eventType": {
      "type": "string",
      "enum": [
        "EnrollmentCreated",
        "EnrollmentActivated",
        "CredentialRotated",
        "PushDenied",
        "EnrollmentSuspended",
        "EnrollmentRevoked",
        "CredentialExpired"
      ]
    },
    "reasonCode": {
      "type": "string",
      "minLength": 1
    },
    "capability": {
      "type": "object",
      "additionalProperties": false,
      "required": [
        "value"
      ],
      "properties": {
        "value": {
          "type": "string",
          "minLength": 1
        }
      }
    },
    "correlationId": {
      "type": "string",
      "minLength": 1
    },
    "metadata": {
      "type": [
        "object",
        "null"
      ],
      "additionalProperties": {
        "type": "string"
      }
    }
  }
}
