{
  "eventId": "evt-share-1",
  "occurredAt": "2026-10-02T09:10:00Z",
  "binding": {
    "sourceTenant": {
      "tenantId": "tenant-a"
    },
    "consumerAccountId": "account-42"
  },
  "enrollmentId": "share-1",
  "principalId": "atlas-pusher-1",
  "source": "sharing:enrollment",
  "eventType": "EnrollmentActivated",
  "reasonCode": "allow",
  "capability": {
    "value": "atlas.landscape.share"
  },
  "correlationId": "corr-share-1",
  "metadata": {
    "transition": "Activate"
  }
}
